"Agency Name",Sub-Agency/Publisher,"Organization Type",Datasets,"Last Entry"
"Department of Energy","DOE/Richland Operations and the Office of River Protection","Federal Government",2,06/23/2017
"Department of Energy","Davenport Newberry Holdings, LLC","Federal Government",12,08/03/2018
"Department of Energy","Dehlsen Associates, LLC","Federal Government",1,02/04/2018
"Department of Energy","Department of Energy","Federal Government",9,10/09/2017
"Department of Energy","Department of Energy Office of Legacy Management, Technical Data Manager","Federal Government",1,06/23/2017
"Department of Energy","Department/Agency level/No publisher","Federal Government",1,08/29/2017
"Department of Energy","District Energy Corporation","Federal Government",3,08/29/2017
"Department of Energy","ElectraTherm, Inc.","Federal Government",16,02/23/2018
"Department of Energy","Energy and Geoscience Institute at the University of Utah","Federal Government",85,08/03/2018
"Department of Energy","Flint Geothermal, LLC","Federal Government",48,11/18/2017
"Department of Energy","GE Global Research","Federal Government",2,08/29/2017
"Department of Energy","Gas Equipment Engineering Corporation","Federal Government",1,08/29/2017
"Department of Energy","Georgia Tech Research Corpration","Federal Government",1,08/29/2017
"Department of Energy","Geothermal Resource Group on behalf of the City of Akutan","Federal Government",1,08/29/2017
"Department of Energy","Geothermal Technical Partners, Inc.","Federal Government",7,08/29/2017
"Department of Energy","Geysers Power Company, LLC","Federal Government",1,08/29/2017
"Department of Energy","Hattenburg Dilley and Linnell","Federal Government",9,02/23/2018
"Department of Energy","Honeywell International, Inc.","Federal Government",1,08/29/2017
"Department of Energy","Idaho National Laboratory","Federal Government",13,08/03/2018
"Department of Energy","Igiugig Village Council","Federal Government",1,12/03/2017
"Department of Energy","Impact Technologies LLC","Federal Government",3,02/23/2018
"Department of Energy","Jim Wilczak","Federal Government",8,03/26/2018
"Department of Energy","Julie Lundquist","Federal Government",3,03/26/2018
"Department of Energy","Katherine McCaffrey","Federal Government",6,03/26/2018
"Department of Energy","Ken Burk","Federal Government",26,03/26/2018
"Department of Energy","Kirk Clawson","Federal Government",3,03/26/2018
"Department of Energy","Laura Leo","Federal Government",4,03/26/2018
"Department of Energy","Lawrence Berkeley National Laboratory","Federal Government",15,08/02/2018
"Department of Energy","Lawrence Livermore National Laboratory","Federal Government",46,02/25/2018
"Department of Energy","Los Alamos National Laboratory","Federal Government",3,08/29/2017
"Department of Energy","M3 Wave","Federal Government",3,12/03/2017
"Department of Energy","Mark Stoelinga","Federal Government",9,03/26/2018
"Department of Energy","Matt Macduff","Federal Government",5,03/26/2018
"Department of Energy",NREL,"Federal Government",1,08/29/2017
"Department of Energy","National Energy Technology Laboratory","Federal Government",27,08/03/2018
"Department of Energy","National Energy Technology Laboratory (NETL)","Federal Government",5,08/03/2018
"Department of Energy","National Nuclear Security Administration","Federal Government",11,06/23/2017
"Department of Energy","National Nuclear Security Administration/LANL","Federal Government",1,06/23/2017
"Department of Energy","National Nuclear Security Administration/SNL","Federal Government",1,06/23/2017
"Department of Energy","National Renewable Energy Laboratory","Federal Government",386,08/03/2018
"Department of Energy","Nevada Bureau of Mines and Geology","Federal Government",5,02/23/2018
"Department of Energy","Nevada Geothermal Power Company","Federal Government",1,08/29/2017
"Department of Energy","New Mexico Bureau of Geology and Mineral Resources","Federal Government",6,08/29/2017
"Department of Energy","New Mexico Institute of Mining and Technology","Federal Government",2,08/29/2017
"Department of Energy",None,"Federal Government",3,01/08/2018
"Department of Energy","Northwest Energy Innovations","Federal Government",1,02/23/2018
"Department of Energy","Northwest National Marine Renewable Energy Center","Federal Government",7,08/03/2018
"Department of Energy","Northwest National Marine Renewable Energy Center (OSU)","Federal Government",1,02/23/2018
"Department of Energy","Northwest National Marine Renewable Energy Center (WU)","Federal Government",1,08/03/2018
"Department of Energy","Northwest National Marine renewable Energy Center (UW)","Federal Government",6,02/23/2018
"Department of Energy","Oak Ridge National Laboratory","Federal Government",18,02/25/2018
"Department of Energy","Ocean Renewable Power Company","Federal Government",3,02/23/2018
"Department of Energy","Office of Civil Rights","Federal Government",1,06/23/2017
"Department of Energy","Office of Economic Impact and Diversity","Federal Government",1,06/23/2017
"Department of Energy","Office of Energy Efficiency & Renewable Energy (EERE)","Federal Government",62,02/23/2018
"Department of Energy","Office of Energy Efficiency and Renewable Energy","Federal Government",1,08/03/2018
"Department of Energy","Office of Information Resources","Federal Government",1,08/03/2018
"Department of Energy","Office of Small and Disadvantaged Business Utilization (OSDBU)","Federal Government",6,04/10/2018
"Department of Energy","Oregon State University","Federal Government",6,08/03/2018
"Department of Energy","Ormat Nevada Inc","Federal Government",19,03/26/2018
"Department of Energy","Oski Energy LLC","Federal Government",12,08/03/2018
"Department of Energy","Pacific Northwest National Laboratory","Federal Government",17,03/09/2018
"Department of Energy","Ram Power, Inc.","Federal Government",3,08/29/2017
"Department of Energy","Regents of the University University of California","Federal Government",1,08/29/2017
"Department of Energy","Resolute Marine Energy, Inc.","Federal Government",2,02/23/2018
"Department of Energy","Ricardo Detroit Technical Center","Federal Government",27,02/23/2018
"Department of Energy","SMU Geothermal Laboratory","Federal Government",1,08/29/2017
"Department of Energy","Sandia National Laboratories","Federal Government",87,08/03/2018
"Department of Energy","Sebastian Otarola","Federal Government",1,03/26/2018
"Department of Energy","Simbol, Inc","Federal Government",1,08/29/2017
"Department of Energy",SmartGrid.gov,"Federal Government",2,08/29/2017
"Department of Energy","Sonia Wharton","Federal Government",2,03/26/2018
"Department of Energy","Southern Research Institute","Federal Government",11,08/03/2018
"Department of Energy","Surprise Valley Electrification Corp. (SVEC)","Federal Government",1,08/29/2017
"Department of Energy","Temple University","Federal Government",1,08/29/2017
"Department of Energy","Terra-Gen Sierra Holdings, LLC","Federal Government",24,08/29/2017
"Department of Energy","Thomas Herges","Federal Government",3,03/26/2018
"Department of Energy","Trabits Group, LLC","Federal Government",2,01/08/2018
"Department of Energy","Tusaar Corp.","Federal Government",18,02/23/2018
"Department of Energy","U.S. Department of Energy (DOE)","Federal Government",10,10/09/2017
"Department of Energy","U.S. Energy Information Administration","Federal Government",83,02/23/2018
"Department of Energy","U.S. Geothermal Inc.","Federal Government",1,03/09/2018
"Department of Energy","U.S. Office of Technology Transitions","Federal Government",1,08/29/2017
"Department of Energy","United States Geological Survey","Federal Government",3,08/29/2017
"Department of Energy","University of Alaska Fairbanks","Federal Government",1,02/23/2018
"Department of Energy","University of California Davis","Federal Government",17,08/03/2018
"Department of Energy","University of Hawaii","Federal Government",26,12/03/2017
"Department of Energy","University of Illinois","Federal Government",1,04/10/2018
"Department of Energy","University of Massachusetts","Federal Government",1,02/23/2018
"Department of Energy","University of Nevada","Federal Government",33,03/09/2018
"Department of Energy","University of Oregon","Federal Government",2,08/03/2018
"Department of Energy","University of Utah","Federal Government",19,08/03/2018
"Department of Energy","University of Washington","Federal Government",10,08/03/2018
"Department of Energy","University of Washington (NNMREC)","Federal Government",1,02/23/2018
"Department of Energy","University of Wisconsin","Federal Government",70,08/03/2018
"Department of Energy","University of Wyoming","Federal Government",6,12/17/2017
"Department of Energy","Utah State University","Federal Government",12,12/03/2017
"Department of Energy","Victor Morris","Federal Government",6,03/26/2018
"Department of Energy","Vortex Hydro Energy","Federal Government",1,02/25/2018
"Department of Energy","Washington Division of Geology and Earth Resources","Federal Government",1,08/29/2017
"Department of Energy","Washington Geological Survey","Federal Government",3,08/03/2018
"Department of Energy","Wind Powering America","Federal Government",1,08/29/2017
"Department of Energy","Wright State University","Federal Government",6,01/17/2018
"Department of Energy","kirk Clawson","Federal Government",4,03/26/2018
"Department of Health and Human Services",,"Federal Government",1571,08/02/2018
"Department of Health and Human Services","Administration for Children and Families","Federal Government",5,08/02/2018
"Department of Health and Human Services","Administration for Children and Families, Department of Health &amp; Human Services","Federal Government",2,07/14/2017
"Department of Health and Human Services","Agency for Healthcare Research and Quality, Department of Health &amp; Human Services","Federal Government",9,12/02/2017
"Department of Health and Human Services","Centers for Disease Control and Prevention","Federal Government",407,08/02/2018
"Department of Health and Human Services","Centers for Disease Control and Prevention, Department of Health &amp; Human Services","Federal Government",48,08/02/2018
"Department of Health and Human Services","Centers for Medicare &amp; Medicaid Services","Federal Government",441,08/02/2018
"Department of Health and Human Services","Centers for Medicare &amp; Medicaid Services, Department of Health &amp; Human Services","Federal Government",4,08/02/2018
"Department of Health and Human Services","Department of Health &amp; Human Services","Federal Government",408,08/02/2018
"Department of Health and Human Services","Department of Health &amp; Human Services, Agency for Healthcare Research and Quality","Federal Government",1,12/02/2017
"Department of Health and Human Services","Department/Agency level/No publisher","Federal Government",21,06/08/2018
"Department of Health and Human Services","Health Resources and Services Administration","Federal Government",1,08/02/2018
"Department of Health and Human Services","Health Resources and Services Administration, Department of Health &amp; Human Services","Federal Government",8,08/02/2018
"Department of Health and Human Services","National Institutes of Health","Federal Government",2,06/17/2014
"Department of Health and Human Services","National Institutes of Health (NIH)","Federal Government",53,07/14/2017
"Department of Health and Human Services","National Library of Medicine (NLM)","Federal Government",44,07/14/2017
"Department of Health and Human Services","Office of Inspector General","Federal Government",1,07/14/2017
"Department of Health and Human Services","Office of the National Coordinator for Health Information Technology, Department of Health &amp; Human Services","Federal Government",2,08/02/2018
"Department of Health and Human Services","Substance Abuse &amp; Mental Health Services Administration","Federal Government",111,08/02/2018
"Department of Health and Human Services","U.S. Food and Drug Administration, Department of Health &amp; Human Services","Federal Government",3,07/14/2017
"Department of Homeland Security",,"Federal Government",8874,02/17/2018
"Department of Homeland Security","Citizenship and Immigration Services, United States","Federal Government",22,08/12/2017
"Department of Homeland Security","Coast Guard, United States","Federal Government",115,02/17/2018
"Department of Homeland Security","Department/Agency level/No publisher","Federal Government",7,02/17/2018
"Department of Homeland Security","Federal Emergency Management Agency","Federal Government",71,02/17/2018
"Department of Homeland Security","Federal Emergency Management Agency","Federal Government",8109,11/14/2017
"Department of Homeland Security","Health Affairs, Office of","Federal Government",2,06/26/2017
"Department of Homeland Security","Immigration and Customs Enforcement, United States","Federal Government",9,08/12/2017
"Department of Homeland Security","National Protection and Programs Directorate","Federal Government",1,06/26/2017
"Department of Homeland Security","Secret Service, United States","Federal Government",1,06/26/2017
"Department of Homeland Security","Transportation Security Administration","Federal Government",15,06/26/2017
"Department of Homeland Security","U.S. Customs and Border Protection","Federal Government",53,02/17/2018
"Department of Homeland Security","Under Secretary / Management","Federal Government",469,02/17/2018
"Department of Housing and Urban Development",,"Federal Government",173,04/25/2017
"Department of Housing and Urban Development","US Bureau of the Census","Federal Government",1,03/08/2017
"Department of Housing and Urban Development","US Department of Housing and Urban Development","Federal Government",172,04/25/2017
"Department of Justice",,"Federal Government",60,03/01/2017
"Department of Justice","BJS - Bureau of Justice Statistics","Federal Government",54,06/02/2016
"Department of Justice","DEA - Drug Enforcement Administration","Federal Government",2,03/01/2017
"Department of Justice","NIJ - National Institute of Justice","Federal Government",2,03/01/2017
"Department of Justice","United States Department of Justice. Office of Justice Programs. National Institute of Justice","Federal Government",2,04/11/2014
"Department of Labor",,"Federal Government",303,03/08/2018
"Department of Labor","Employee Benefits Security Administration","Federal Government",5,06/01/2017
"Department of Labor","U.S. Department of Labor Benefits.gov Program","Federal Government",21,09/21/2017
"Department of Labor","U.S. Department of Labor Bureau of International Labor Affairs","Federal Government",16,03/08/2018
"Department of Labor","U.S. Department of Labor Bureau of Labor Statistics","Federal Government",95,03/08/2018
"Department of Labor","U.S. Department of Labor Chief Economist's Office","Federal Government",1,06/01/2017
"Department of Labor","U.S. Department of Labor Employee Benefits Security Administration","Federal Government",1,06/01/2017
"Department of Labor","U.S. Department of Labor Employment and Training Administration","Federal Government",41,03/08/2018
"Department of Labor","U.S. Department of Labor Mine Safety and Health Administration","Federal Government",18,06/01/2017
"Department of Labor","U.S. Department of Labor Occupational Safety and Health Administration","Federal Government",11,06/01/2017
"Department of Labor","U.S. Department of Labor Office of Federal Contract Compliance Programs","Federal Government",2,06/01/2017
"Department of Labor","U.S. Department of Labor Office of Job Corps","Federal Government",4,03/01/2017
"Department of Labor","U.S. Department of Labor Office of Labor-Management Standards","Federal Government",1,03/01/2017
"Department of Labor","U.S. Department of Labor Office of Public Affairs","Federal Government",24,06/01/2017
"Department of Labor","U.S. Department of Labor Office of Worker's Compensation Program","Federal Government",1,03/01/2017
"Department of Labor","U.S. Department of Labor Office of Workers' Compensation Program","Federal Government",11,03/01/2017
"Department of Labor","U.S. Department of Labor Office of the Assistant Secretary for Policy","Federal Government",1,06/01/2017
"Department of Labor","U.S. Department of Labor Office of the Solicitor","Federal Government",6,03/01/2017
"Department of Labor","U.S. Department of Labor Wage and Hour Division","Federal Government",10,06/01/2017
"Department of Labor","U.S. Department of Labor, Bureau of Labor Statistics","Federal Government",31,03/08/2018
"Department of Labor","Wage and Hour Division","Federal Government",3,06/01/2017
"Department of State",,"Federal Government",129,05/13/2018
"Department of State","Department/Agency level/No publisher","Federal Government",21,05/13/2018
"Department of State","U.S. Department of State","Federal Government",108,04/23/2016
"Department of Transportation",,"Federal Government",883,08/01/2018
"Department of Transportation","Bureau of Transportation Statisitics","Federal Government",3,03/27/2018
"Department of Transportation","Department/Agency level/No publisher","Federal Government",145,10/09/2017
"Department of Transportation","Federal Aviation Administration","Federal Government",342,05/23/2017
"Department of Transportation","Federal Highway Administration","Federal Government",42,03/01/2017
"Department of Transportation","Federal Motor Carrier Safety Administration","Federal Government",48,03/01/2017
"Department of Transportation","Federal Railroad Administration","Federal Government",25,03/01/2017
"Department of Transportation","Federal Transit Administration","Federal Government",11,11/30/2016
"Department of Transportation","Maritime Administration","Federal Government",20,03/01/2017
"Department of Transportation","National Highway Traffic Safety Administration","Federal Government",52,03/01/2017
"Department of Transportation","Office of the Inspector General","Federal Government",3,03/01/2017
"Department of Transportation","Office of the Secretary of Transportation","Federal Government",55,03/01/2017
"Department of Transportation","Pipeline and Hazardous Materials Safety Administration","Federal Government",16,08/25/2017
"Department of Transportation","Research and Innovative Technology Administration","Federal Government",33,10/09/2017
"Department of Transportation","Saint Lawrence Seaway Development Corporation","Federal Government",12,03/01/2017
"Department of Transportation","Surface Transportation Board","Federal Government",21,03/01/2017
"Department of Transportation",USDOT,"Federal Government",54,08/01/2018
"Department of Transportation",data.transportation.gov,"Federal Government",1,11/14/2017
"Department of Veterans Affairs",,"Federal Government",1219,08/03/2018
"Department of Veterans Affairs","Department of Veterans Affairs","Federal Government",1218,08/03/2018
"Department of Veterans Affairs","Department/Agency level/No publisher","Federal Government",1,05/20/2018
"Department of the Interior",,"Federal Government",84156,08/05/2018
"Department of the Interior","Arizona State Office, Bureau of Land Management - GIS Manager","Federal Government",4,05/19/2018
"Department of the Interior","Avenza Maps","Federal Government",7,02/23/2018
"Department of the Interior",BLM,"Federal Government",20,05/21/2018
"Department of the Interior","BLM - Eric Hiebenthal","Federal Government",2,02/23/2018
"Department of the Interior","BLM - Roger Blouch","Federal Government",5,05/21/2018
"Department of the Interior","BLM - Russell Slatton","Federal Government",227,05/21/2018
"Department of the Interior","BLM Colorado - State Geospatial Lead","Federal Government",88,05/21/2018
"Department of the Interior","BLM Colorado Royal Gorge Field Office","Federal Government",3,05/21/2018
"Department of the Interior","BLM Colorado State Office","Federal Government",6,05/21/2018
"Department of the Interior","BLM Eastern States - Ryan Tietjen","Federal Government",5,05/19/2018
"Department of the Interior","BLM Moab Field Office","Federal Government",8,03/01/2018
"Department of the Interior","BLM National Operations Center, OC530 - NOC Data Management Lead","Federal Government",19,05/21/2018
"Department of the Interior","BLM New Mexico Fire Program","Federal Government",2,05/21/2018
"Department of the Interior","BLM New Mexico Oil & Gas Program","Federal Government",11,05/21/2018
"Department of the Interior","BLM Oregon State Office","Federal Government",3,05/21/2018
"Department of the Interior","BLM Utah State Office","Federal Government",75,05/21/2018
"Department of the Interior","BLM, Colorado State Office","Federal Government",32,05/21/2018
"Department of the Interior","BLM, Eastern State Office","Federal Government",222,05/21/2018
"Department of the Interior","BLM, Idaho State Office","Federal Government",3,05/21/2018
"Department of the Interior","BLM, Idaho State Office - CM","Federal Government",3,05/21/2018
"Department of the Interior","BLM, New Mexico State Office","Federal Government",9,05/21/2018
"Department of the Interior",BLM/USFS,"Federal Government",3,05/21/2018
"Department of the Interior","Bureau Indian Affairs","Federal Government",9,06/08/2018
"Department of the Interior","Bureau of Indian Affairs","Federal Government",3,06/08/2018
"Department of the Interior","Bureau of Land Management","Federal Government",2400,06/08/2018
"Department of the Interior","Bureau of Land Management - Eric Hiebenthal","Federal Government",170,05/21/2018
"Department of the Interior","Bureau of Land Management - New Mexico State Office - GIS Manager","Federal Government",23,06/08/2018
"Department of the Interior","Bureau of Land Management - New Mexico State Office - State GIS Manager","Federal Government",5,06/08/2018
"Department of the Interior","Bureau of Land Management, Arizona State Office - Brandon Colvin","Federal Government",6,06/08/2018
"Department of the Interior","Bureau of Land Management, Arizona State Office - GIS Manager","Federal Government",3,06/08/2018
"Department of the Interior","Bureau of Land Management, Colorado State Office - State Geospatial Lead","Federal Government",28,06/08/2018
"Department of the Interior","Bureau of Land Management, Idaho State Office, Engineering and Geosciences - CMavencamp","Federal Government",29,05/21/2018
"Department of the Interior","Bureau of Land Management, Nevada State Office","Federal Government",41,06/08/2018
"Department of the Interior","Bureau of Land Management, Nevada State Office - GIS Manager","Federal Government",6,06/08/2018
"Department of the Interior","Bureau of Land Management, Oregon State Office - Eric Hiebenthal","Federal Government",25,05/21/2018
"Department of the Interior","Bureau of Ocean Energy Management","Federal Government",108,06/08/2018
"Department of the Interior","Bureau of Safety and Environmental Enforcement (BSEE)","Federal Government",5,05/20/2018
"Department of the Interior",COSO,"Federal Government",6,05/21/2018
"Department of the Interior","Climate Science Centers","Federal Government",269,05/21/2018
"Department of the Interior","Colorado River Valley Field Office BLM - Field Office GIS Specialist","Federal Government",1,02/23/2018
"Department of the Interior","Department of the Interior (DOI), Bureau of Land Management (BLM), Idaho State Office","Federal Government",3,05/21/2018
"Department of the Interior","Department/Agency level/No publisher","Federal Government",18480,06/08/2018
"Department of the Interior","Federal Geographic Data Committee","Federal Government",7,12/06/2017
"Department of the Interior","Fish and Wildlife Service","Federal Government",45881,06/08/2018
"Department of the Interior","Haskell Indian Nations University","Federal Government",1,04/10/2014
"Department of the Interior","Idaho BLM","Federal Government",3,05/21/2018
"Department of the Interior","National Park Service","Federal Government",1044,06/08/2018
"Department of the Interior","Nevada Department of Wildlife","Federal Government",3,05/21/2018
"Department of the Interior",OR,"Federal Government",5,-
"Department of the Interior","OR BLM","Federal Government",720,-
"Department of the Interior","Oregon State Office, Bureau of Land Management","Federal Government",3,05/21/2018
"Department of the Interior","Southwestern Indian Polytechnic Institute","Federal Government",1,04/10/2014
"Department of the Interior","U.S. Department of the Interior (DOI), Bureau of Land Management (BLM), Idaho State Office","Federal Government",48,05/21/2018
"Department of the Interior","U.S. Department of the Interior (DOI), Bureau of Land Management (BLM), Idaho State Office - C Mavencamp","Federal Government",1,05/21/2018
"Department of the Interior","U.S. Department of the Interior, Bureau of Land Management (BLM), Idaho State Office","Federal Government",3,05/21/2018
"Department of the Interior","U.S. Fish and Wildlife Service","Federal Government",271,05/21/2018
"Department of the Interior","U.S. Geological Survey","Federal Government",73,08/05/2018
"Department of the Interior","U.S. Geological Survey","Federal Government",13664,05/21/2018
"Department of the Interior","US Fish and Wildlife Service","Federal Government",3,05/21/2018
"Department of the Interior","Utah BLM State Office","Federal Government",48,05/21/2018
"Department of the Treasury",,"Federal Government",266,02/27/2018
"Department of the Treasury","Bureau of Engraving and Printing","Federal Government",1,03/29/2016
"Department of the Treasury","Bureau of the Fiscal Service","Federal Government",80,11/07/2017
"Department of the Treasury","Community Development Financial Institutions","Federal Government",2,03/29/2016
"Department of the Treasury","Community Development Financial Institutions Fund","Federal Government",1,03/29/2016
"Department of the Treasury","Council of the Inspector Generals","Federal Government",1,02/27/2018
"Department of the Treasury","Department of Justice","Federal Government",1,02/27/2018
"Department of the Treasury","Department of the Treasury","Federal Government",66,02/27/2018
