"Agency Name",Sub-Agency/Publisher,"Organization Type",Datasets,"Last Entry"
"Broadcasting Board of Governors",,"Other Federal",6,01/12/2014
"Commodity Futures Trading Commission",,"Other Federal",3,01/12/2014
"Consumer Financial Protection Bureau",,"Other Federal",2,09/26/2015
"Consumer Financial Protection Bureau","Consumer Financial Protection Bureau","Other Federal",2,09/26/2015
"Corporation for National and Community Service",,"Other Federal",3,01/12/2014
"Court Services and Offender Supervision Agency",,"Other Federal",1,01/12/2014
"Department of Agriculture",,"Federal Government",1429,08/02/2018
"Department of Agriculture","Agricultural Marketing Service","Federal Government",43,02/04/2018
"Department of Agriculture","Agricultural Marketing Service, Department of Agriculture","Federal Government",42,02/04/2018
"Department of Agriculture","Agricultural Research Service","Federal Government",12,03/29/2018
"Department of Agriculture","Agricultural Research Service, Department of Agriculture","Federal Government",43,03/29/2018
"Department of Agriculture","Animal and Plant Health Inspection Service","Federal Government",1,02/04/2018
"Department of Agriculture","Animal and Plant Health Inspection Service, Department of Agriculture","Federal Government",2,02/04/2018
"Department of Agriculture","Department of Agriculture","Federal Government",12,03/29/2018
"Department of Agriculture","Department of Agriculture, OCIO","Federal Government",2,02/04/2018
"Department of Agriculture","Department/Agency level/No publisher","Federal Government",3,02/07/2017
"Department of Agriculture","Departmental Management, Department of Agriculture","Federal Government",1,03/29/2018
"Department of Agriculture","Economic Research Service, Department of Agriculture","Federal Government",38,03/29/2018
"Department of Agriculture","Economic Research Service, U.S. Department of Agriculture","Federal Government",53,03/29/2018
"Department of Agriculture","Economic Research Service, US Department of Agriculture","Federal Government",1,03/29/2018
"Department of Agriculture","Economic Research Service:  Market and Trade Economics Division","Federal Government",25,//
"Department of Agriculture","Economic Research Service: Food Economics Division","Federal Government",9,//
"Department of Agriculture","Economic Research Service: Resource and Rural Economics Division","Federal Government",13,//
"Department of Agriculture","Farm Service Agency","Federal Government",22,11/08/2017
"Department of Agriculture","Farm Service Agency, Department of Agriculture","Federal Government",113,02/04/2018
"Department of Agriculture","Federal Grain Inspection Service","Federal Government",2,02/04/2018
"Department of Agriculture","Food Safety Inspection Service","Federal Government",1,02/04/2018
"Department of Agriculture","Food Safety and Inspection Service","Federal Government",4,02/04/2018
"Department of Agriculture","Food Safety and Inspection Service, Department of Agriculture","Federal Government",1,02/04/2018
"Department of Agriculture","Food Safety and Inspection Service, United States Department of Agriculture","Federal Government",1,02/04/2018
"Department of Agriculture","Food and Nutrition Service","Federal Government",106,02/04/2018
"Department of Agriculture","Food and Nutrition Service, Department of Agriculture","Federal Government",11,02/04/2018
"Department of Agriculture","Foreign Agricultural Service","Federal Government",2,02/04/2018
"Department of Agriculture","Foreign Agricultural Service, Department of Agriculture","Federal Government",10,02/04/2018
"Department of Agriculture",IRI,"Federal Government",1,02/04/2018
"Department of Agriculture",NRCS,"Federal Government",100,02/04/2018
"Department of Agriculture",NRCs,"Federal Government",1,02/04/2018
"Department of Agriculture","National Agricultural Statistics Service, Department of Agriculture","Federal Government",6,02/04/2018
"Department of Agriculture","National Appeals Division, Department of Agriculture","Federal Government",1,03/29/2018
"Department of Agriculture","National Institute of Food and Agriculture, Department of Agriculture","Federal Government",1,02/04/2018
"Department of Agriculture","Natural Resources Conservation Service, Colorado State University","Federal Government",1,02/04/2018
"Department of Agriculture","Office of Chief Information Officer","Federal Government",4,02/04/2018
"Department of Agriculture","Packers and Stockyards Program","Federal Government",1,02/04/2018
"Department of Agriculture","Packers and Stockyards Programs","Federal Government",2,02/04/2018
"Department of Agriculture","Rural Development, Department of Agriculture","Federal Government",71,02/04/2018
"Department of Agriculture","U. S. Department of Agriculture","Federal Government",7,03/29/2018
"Department of Agriculture","U.S. Forest Service","Federal Government",162,08/02/2018
"Department of Agriculture","USDA Economic Research Service","Federal Government",1,03/29/2018
"Department of Agriculture","USDA NAL","Federal Government",490,08/02/2018
"Department of Agriculture",USDA-GIPSA,"Federal Government",5,02/04/2018
"Department of Agriculture","United States Department of Agriculture","Federal Government",2,02/04/2018
"Department of Commerce",,"Federal Government",67267,08/03/2018
"Department of Commerce",(),"Federal Government",2,-
"Department of Commerce","(Point of Contact)","Federal Government",12,02/16/2017
"Department of Commerce","(Point of Contact); Penn State University (Principal Investigator); Temple University College of Science and Technology (Principal Investigator)","Federal Government",1,02/26/2016
"Department of Commerce","(Principal Investigator)","Federal Government",34,02/16/2017
"Department of Commerce","(Principal Investigator); Alfred Wegener Institute (Principal Investigator); National Snow and Ice Data Center (Point of Contact)","Federal Government",1,02/26/2016
"Department of Commerce","(Principal Investigator); Arctic and Antarctic Research Institute (Principal Investigator);  MeteorologyArctic and Antarctic Research Institute (Principal Investigator); National Snow and Ice Data Center (Point of Contact)","Federal Government",1,02/26/2016
"Department of Commerce","(Principal Investigator); Delft Univerisyt of Technology (Principal Investigator); National Snow and Ice Data Center (Point of Contact)","Federal Government",1,02/26/2016
"Department of Commerce","(Principal Investigator); International Association for the Environmental Communication (Principal Investigator); National Snow and Ice Data Center (Point of Contact)","Federal Government",1,02/26/2016
"Department of Commerce","(Principal Investigator); Joint Institute for the Study of the Atmospheres and the Oceans (Principal Investigator); NOAA/Pacific Marine Environmental Laboratory (Principal Investigator)","Federal Government",1,02/26/2016
"Department of Commerce","(Principal Investigator); NASA Goddard Space Flight Center (Principal Investigator); National Snow and Ice Data Center (Point of Contact, Principal Investigator)","Federal Government",1,02/26/2016
"Department of Commerce","(Principal Investigator); National Snow and Ice Data Center (Point of Contact)","Federal Government",6,02/16/2017
"Department of Commerce","(Principal Investigator); National Snow and Ice Data Center (Point of Contact); Alfred Wegener Institute for Polar and Marine Research (Principal Investigator)","Federal Government",1,02/26/2016
"Department of Commerce","(Principal Investigator); National Snow and Ice Data Center (Point of Contact); University of Wisconsin-Madison (Principal Investigator)","Federal Government",1,02/26/2016
"Department of Commerce","(Principal Investigator); Polar Science Center (Principal Investigator); National Snow and Ice Data Center (Point of Contact)","Federal Government",1,02/26/2016
"Department of Commerce","(Principal Investigator); U.S. Geological Survey (Principal Investigator); National Snow and Ice Data Center (Point of Contact)","Federal Government",1,02/26/2016
"Department of Commerce","(Principal Investigator, Originator)","Federal Government",3,02/26/2016
"Department of Commerce","(Principal Investigator, Point of Contact, Originator)","Federal Government",1,02/26/2016
"Department of Commerce","Bureau of Economic Analysis","Federal Government",10,03/02/2018
"Department of Commerce","Bureau of Industry and Security, Department of Commerce","Federal Government",2,03/02/2018
"Department of Commerce","Canadian Ice Service (Principal Investigator); National Snow and Ice Data Center (Point of Contact)","Federal Government",1,02/26/2016
"Department of Commerce","Carnegie Institute of Washington (Principal Investigator); National Snow and Ice Data Center (Point of Contact)","Federal Government",1,02/26/2016
"Department of Commerce","Climate Prediction Center, NOAA (Point of Contact)","Federal Government",84,02/26/2016
"Department of Commerce","Climate Prediction Center, National Centers for Environmental Prediction, National Weather Service, NOAA, U.S. Department of Commerce (Point of Contact)","Federal Government",1,02/26/2016
"Department of Commerce","Columbia University Lamont-Doherty Earth Observatory (LDEO) Lamont-Doherty Core Repository (LDCR) (Point of Contact)","Federal Government",1,02/26/2016
"Department of Commerce","DOC/NOAA/NESDIS/NCDC > National Climatic Data Center, NESDIS, NOAA, U.S. Department of Commerce (Point of Contact)","Federal Government",3,02/26/2016
"Department of Commerce","DOC/NOAA/NESDIS/NCEI > National Centers for Environmental Information, NESDIS, NOAA, U.S. Department of Commerce (Point of Contact)","Federal Government",482,02/16/2017
"Department of Commerce","DOC/NOAA/NESDIS/NCEI > National Centers for Environmental Information, NESDIS, NOAA, U.S. Department of Commerce (Point of Contact); STAR > Center for Satellite Applications and Research (Point of Contact)","Federal Government",1,02/26/2016
"Department of Commerce","DOC/NOAA/NESDIS/NODC/NCDDC> National Coastal Data Development Center (Custodian)","Federal Government",12,02/26/2016
"Department of Commerce","DOC/NOAA/NMFS/AFSC > Alaska Fisheries Science Center (Principal Investigator)","Federal Government",2,02/26/2016
"Department of Commerce","Denver Federal Center (Principal Investigator); National Snow and Ice Data Center (Principal Investigator, Point of Contact)","Federal Government",1,02/26/2016
"Department of Commerce","Department of Agriculture and Board of Trustees of Michigan State University","Federal Government",1,08/14/2015
"Department of Commerce","Department of Commerce","Federal Government",21,08/01/2018
"Department of Commerce","Department/Agency level/No publisher","Federal Government",2,02/26/2016
"Department of Commerce","Florida State University (FSU) Antarctic Marine Geology Research Facility (AMGRF) (Originator, Point of Contact)","Federal Government",1,02/26/2016
"Department of Commerce",HUD,"Federal Government",1,03/02/2018
"Department of Commerce","IFREMER/CERSAT > Institut Francais de Recherche pour l'Exploitation de la Mer, Center d'Exploitation et de Recherche Satellitaire (Point of Contact); DOC/NOAA/NESDIS/NCEI > National Centers for Environmental Information, NESDIS, NOAA, U.S. Department of Commerce (Point of Contact)","Federal Government",3,02/26/2016
"Department of Commerce","International Trade Administration","Federal Government",8,05/13/2017
"Department of Commerce","International Trade Administration, Department of Commerce","Federal Government",29,05/13/2017
"Department of Commerce","NOAA Fisheries Headquarters (Point of Contact)","Federal Government",2,02/26/2016
"Department of Commerce","NOAA NDBC, NOAA NMFS SWFSC ERD (Point of Contact)","Federal Government",1,02/26/2016
"Department of Commerce","NOAA NODC (Point of Contact)","Federal Government",1,02/16/2017
"Department of Commerce","NOAA Office for Coastal Management (OCM) (Point of Contact)","Federal Government",1,02/26/2016
"Department of Commerce","NOAA Office for Coastal Management (Point of Contact)","Federal Government",8,02/26/2016
"Department of Commerce","NOAA/Great Lakes Environmental Research Laboratory (Point of Contact)","Federal Government",1,02/16/2017
"Department of Commerce","NOAA/NESDIS/NCEI - National Centers for Environmental Information (Point of Contact)","Federal Government",7,02/16/2017
"Department of Commerce","NOAA/NESDIS/NGDC - National Geophysical Data Center (Point of Contact)","Federal Government",2,02/26/2016
"Department of Commerce","NOAA/NESDIS/NODC/NCDDC -- National Coastal Data Development Center (Point of Contact)","Federal Government",2,02/26/2016
"Department of Commerce","NOAA/NESDIS/NODC/NCDDC-National Coastal Data Development Center (Point of Contact)","Federal Government",290,02/26/2016
"Department of Commerce","NOAA/NMFS/OHC/HPD (Point of Contact)","Federal Government",1,02/26/2016
"Department of Commerce","National Institute of Standards and Technology","Federal Government",284,08/01/2018
"Department of Commerce","National Marine Mammal Laboratory (Point of Contact)","Federal Government",1,02/26/2016
"Department of Commerce","National Oceanic and Atmospheric Administration","Federal Government",4,02/26/2016
"Department of Commerce","National Oceanic and Atmospheric Administration","Federal Government",64720,02/08/2018
"Department of Commerce","National Snow and Ice Data Center (Point of Contact)","Federal Government",3,02/16/2017
"Department of Commerce","National Snow and Ice Data Center (Point of Contact); National Weather Service (Principal Investigator)","Federal Government",1,02/26/2016
"Department of Commerce","National Snow and Ice Data Center (Point of Contact); US Department of Transportation, Maritime Administration (Principal Investigator)","Federal Government",1,02/26/2016
"Department of Commerce","National Snow and Ice Data Center (Principal Investigator)","Federal Government",1,02/16/2017
"Department of Commerce","National Technical Information Service, Department of Commerce","Federal Government",1,09/17/2015
"Department of Commerce","National Telecommunication and Information Administration","Federal Government",2,09/17/2015
"Department of Commerce","National Telecommunication and Information Administration, Department of Commerce","Federal Government",30,09/17/2015
"Department of Commerce","National Weather Service, Department of Commerce","Federal Government",11,09/01/2016
"Department of Commerce","North American Submarine Cable Association (NASCA) (Point of Contact)","Federal Government",1,02/26/2016
"Department of Commerce","OFFICE OF  INSPECTOR GENERAL","Federal Government",1,02/16/2017
"Department of Commerce","OFFICE OF INSPECTOR GENERAL","Federal Government",1,02/16/2017
"Department of Commerce","Office of Inspector General","Federal Government",52,02/16/2017
"Department of Commerce","Office of Spectrum Management","Federal Government",1,02/26/2016
"Department of Commerce","Office of the Inspector General","Federal Government",3,02/16/2017
"Department of Commerce","Officer of Inspector General","Federal Government",1,02/16/2017
"Department of Commerce","Officie of Inspector General","Federal Government",1,12/02/2015
"Department of Commerce","Oregon State University (OSU) College of Earth, Ocean and Atmospheric Sciences (CEOAS) Marine Geology Repository (MGR) (Originator, Point of Contact)","Federal Government",1,02/26/2016
"Department of Commerce","Penn State University (Principal Investigator)","Federal Government",1,02/26/2016
"Department of Commerce","Southeast Fisheries Science Center (Point of Contact)","Federal Government",1,02/26/2016
"Department of Commerce","U.S. Census Bureau, Department of Commerce","Federal Government",1,07/15/2016
"Department of Commerce","U.S. Census Bureau, U.S. Department of Commerce","Federal Government",1,07/15/2016
"Department of Commerce","U.S. Department of Commerce","Federal Government",4,03/02/2018
"Department of Commerce","UCO/LASP > Laboratory for Atmospheric and Space Physics, University of Colorado (Point of Contact); DOC/NOAA/NESDIS/NCEI > National Centers for Environmental Information, NESDIS, NOAA, U.S. Department of Commerce (Point of Contact)","Federal Government",2,02/26/2016
"Department of Commerce","US Census Burea, Dept of Commerce","Federal Government",1,07/15/2016
"Department of Commerce","US Census Bureau","Federal Government",820,08/03/2018
"Department of Commerce","US Census Bureau,","Federal Government",1,03/02/2018
"Department of Commerce","US Census Bureau, Department of Commerce","Federal Government",206,03/02/2018
"Department of Commerce","US Census Bureau, Dept of Commerce","Federal Government",6,03/02/2018
"Department of Commerce","US Census Bureau, US Department of Commerce","Federal Government",43,03/02/2018
"Department of Commerce","University of Alaska at Fairbanks (Principal Investigator); University of Colorado at Boulder (Principal Investigator); National Snow and Ice Data Center (Point of Contact, Principal Investigator)","Federal Government",1,02/26/2016
"Department of Commerce","University of California San Diego (UCSD) Scripps Institution of Oceanography (SIO) Geological Collections (Point of Contact)","Federal Government",1,02/26/2016
"Department of Commerce","University of Hawaii at Manoa, Department of Geology and Geophysics (Point of Contact)","Federal Government",1,02/26/2016
"Department of Commerce","University of Illinois at Urbana-Champaign (Principal Investigator); Denver Botanic Gardens (Principal Investigator); National Snow and Ice Data Center (Point of Contact, Principal Investigator)","Federal Government",1,02/16/2017
"Department of Commerce","University of Illinois at Urbana-Champaign (Principal Investigator); National Snow and Ice Data Center (Point of Contact)","Federal Government",1,02/16/2017
"Department of Commerce","University of Maryland","Federal Government",1,08/14/2015
"Department of Commerce","University of Minnesota National Lacustrine Core Repository (LacCore) (Point of Contact)","Federal Government",1,02/26/2016
"Department of Commerce","University of Rhode Island (URI) Graduate School of Oceanography (GSO) Marine Geological Samples Laboratory (MGSL) (Point of Contact)","Federal Government",1,02/26/2016
"Department of Commerce","University of Washington (Principal Investigator); National Snow and Ice Data Center (Point of Contact)","Federal Government",1,02/26/2016
"Department of Commerce","Wisconsin Alumni Research Foundation","Federal Government",1,08/14/2015
"Department of Defense",,"Federal Government",308,10/09/2017
"Department of Defense","Army Corps of Engineers","Federal Government",127,07/22/2015
"Department of Defense","Defense Commissary Agency","Federal Government",1,01/18/2017
"Department of Defense","Defense Logistics Agency","Federal Government",4,01/18/2017
"Department of Defense","Department of Defense","Federal Government",156,01/19/2017
"Department of Defense","Department of Defense Inspector General","Federal Government",1,01/18/2017
"Department of Defense","Department of the Air Force","Federal Government",1,01/18/2017
"Department of Defense","Federal Voting Assistance Program","Federal Government",7,01/18/2017
"Department of Defense","National Geospatial-Intelligence Agency","Federal Government",3,11/17/2015
"Department of Defense","Office of the Secretary of Defense","Federal Government",2,01/18/2017
"Department of Defense","US Army Corps of Engineers","Federal Government",3,10/09/2017
"Department of Defense","World Wide Human Geography Data Working Group","Federal Government",3,07/18/2014
"Department of Education",,"Federal Government",370,08/03/2018
"Department of Education","Institute of Museum and Library Services","Federal Government",14,01/11/2018
"Department of Education","Nationa Center for Education Statistics","Federal Government",1,01/30/2017
"Department of Education","National Center for Education Evaluation and Regional Assistance","Federal Government",7,01/11/2018
"Department of Education","National Center for Education Statistics","Federal Government",171,03/26/2018
"Department of Education","National Center for Special Education Research","Federal Government",2,03/26/2018
"Department of Education","Office for Civil Rights","Federal Government",8,03/26/2018
"Department of Education","Office of Career, Technical, and Adult Education","Federal Government",19,03/26/2018
"Department of Education","Office of Elementary and Secondary Education","Federal Government",19,03/26/2018
"Department of Education","Office of Federal Student Aid","Federal Government",33,08/03/2018
"Department of Education","Office of Innovation and Improvement","Federal Government",16,06/03/2017
"Department of Education","Office of Language Acquisition","Federal Government",2,03/26/2018
"Department of Education","Office of Migrant Education","Federal Government",2,03/26/2018
"Department of Education","Office of Planning, Evaluation, and Policy Development","Federal Government",1,09/29/2017
"Department of Education","Office of Postsecondary Education","Federal Government",16,08/03/2018
"Department of Education","Office of Safe and Healthy Students","Federal Government",11,09/29/2017
"Department of Education","Office of Special Education Programs","Federal Government",25,03/26/2018
"Department of Education","Office of Special Education and Rehabilitative Services","Federal Government",2,09/29/2017
"Department of Education","Office of Vocational and Adult Education","Federal Government",2,06/03/2017
"Department of Education","Office of the Chief Information Officer","Federal Government",5,09/29/2017
"Department of Education","U.S. Department of Education","Federal Government",14,03/26/2018
"Department of Energy",,"Federal Government",2524,08/03/2018
"Department of Energy",ABB,"Federal Government",2,12/03/2017
"Department of Energy","ATLAS Geosciences Inc","Federal Government",2,11/08/2017
"Department of Energy","Aditya Choukulkar","Federal Government",3,03/26/2018
"Department of Energy","AltaRock Energy Inc","Federal Government",12,02/23/2018
"Department of Energy","Argonne National Laboratory","Federal Government",10,08/02/2018
"Department of Energy","Arizona State Geological Survey","Federal Government",1,08/29/2017
"Department of Energy","Arthur Mansure","Federal Government",1,02/23/2018
"Department of Energy","Atmospheric Radiation Measurement Data Center","Federal Government",903,02/28/2018
"Department of Energy","Beowawe Power LLC","Federal Government",1,08/29/2017
"Department of Energy","Bob Lawrence and Associates, Inc.","Federal Government",1,08/29/2017
"Department of Energy","Brookhaven National Laboratory","Federal Government",5,02/04/2018
"Department of Energy","California State University Long Beach","Federal Government",3,08/03/2018
"Department of Energy","Carnegie Mellon University","Federal Government",2,01/03/2018
"Department of Energy","Colorado School of Mines","Federal Government",1,12/03/2017
"Department of Energy","Cornell University","Federal Government",13,03/09/2018
"Department of Energy",DOE,"Federal Government",29,08/02/2018
"Department of Energy","DOE ARPA-E","Federal Government",2,06/23/2017
"Department of Energy","DOE Argonne National Laboratory","Federal Government",1,08/02/2018
"Department of Energy","DOE Congressional and Intergovernmental Affairs","Federal Government",2,06/23/2017
"Department of Energy","DOE Electricity Delivery and Energy Reliability","Federal Government",2,06/23/2017
"Department of Energy","DOE Energy Policy and Systems Analysis","Federal Government",2,06/23/2017
"Department of Energy","DOE General Counsel","Federal Government",3,06/23/2017
"Department of Energy","DOE Indian Energy Policy and Programs","Federal Government",1,06/23/2017
"Department of Energy","DOE Inspector General","Federal Government",1,06/23/2017
"Department of Energy","DOE Intelligence and Counterintelligence","Federal Government",1,06/23/2017
"Department of Energy","DOE International Affairs","Federal Government",1,06/23/2017
"Department of Energy","DOE Loan Programs Office","Federal Government",2,06/23/2017
"Department of Energy","DOE National Renewable Energy Laboratory","Federal Government",9,08/02/2018
"Department of Energy","DOE Nuclear Energy","Federal Government",1,06/23/2017
"Department of Energy","DOE Oak Ridge National Laboratory","Federal Government",2,10/09/2017
"Department of Energy","DOE Offfice of General Council","Federal Government",2,06/23/2017
"Department of Energy","DOE Office of Chief Financial Officer","Federal Government",1,06/23/2017
"Department of Energy","DOE Office of Chief Human Capital Officer","Federal Government",1,06/23/2017
"Department of Energy","DOE Office of Chief Information Officer","Federal Government",2,06/23/2017
"Department of Energy","DOE Office of Energy Efficiency and Renewable Energy","Federal Government",3,10/09/2017
"Department of Energy","DOE Office of Legacy Management","Federal Government",4,06/23/2017
"Department of Energy","DOE Office of Nuclear Energy","Federal Government",2,06/23/2017
"Department of Energy","DOE Office of Science","Federal Government",1,06/23/2017
"Department of Energy","DOE Office of Science and Technical Information","Federal Government",1,06/23/2017
"Department of Energy","DOE Office of Scientific and Technical Information","Federal Government",5,06/23/2017
"Department of Energy","DOE Public Affairs","Federal Government",1,06/23/2017
"Department of Energy","DOE Small and Disadvantaged Business Utilization","Federal Government",1,06/23/2017
"Department of Energy","DOE/Environmental Management Consolidated Business Center","Federal Government",1,10/10/2015
"Department of Energy","DOE/Oak Ridge National Laboratory","Federal Government",1,10/09/2017
"Department of Energy","DOE/Office of Environmental Management","Federal Government",6,06/23/2017
"Department of Energy","DOE/Office of Fossil Energy","Federal Government",5,10/09/2017
"Department of Energy","DOE/Office of Hearings and Appeals","Federal Government",1,06/23/2017
