Agency_Name,Laboratory_Name,Laboratory_ID,Facility,Address,ZIP Code,City,State,Country,Description,Type,Link,POC Email,POC Phone
DOE,Ames Laboratory,,Materials Preparation Center,"Technical and Administrative Services Facility
#311",50011,Ames,IA,US,"MPC is recognized throughout the worldwide research community for its unique capabilities in  purification, preparation, and characterization of: rare earth metals, single crystal growth, metal powders/atomization, alkaline-earth metals, and refractory metal. Established in 1981, the MPC is a one-of-a-kind facility, which is acutely sensitive to the needs of researchers. Providing research and developmental quantities of high-purity materials and unique characterization services to scientists at university, industry and government facilities on a cost-recovery basis, the MPC allows access to novel materials and new technologies as they are developed.",R&D Agreements for Facility Access,https://www.ameslab.gov/mpc,mpc@ameslab.gov,(515) 294-2770
DOE,Ames Laboratory,,Dynamical Nuclear Polarization NMR Facility,"Technical and Administrative Services Facility
#312",50011,Ames,IA,US, A new acquisition (Summer 2014) will provide a giant step  forward in world-class solid-state nuclear magnetic resonance (NMR) capabilities with a  Dynamic Nuclear Polarization-NMR spectrometer. The instrument will be the first of its kind to be focused on materials and materials chemistry in the United States.,R&D Agreements for Facility Access,https://www.ameslab.gov/news/inquiry/2013-2-cutting-edge-nmr-technology-headed-ames-lab,jenks@ameslab.gov ,(515) 294-2771
DOE,Ames Laboratory,,Powder-to-Parts (Additive Manufacuring),"Technical and Administrative Services Facility
#313",50011,Ames,IA,US,"The Ames Lab Powder to Parts Facility is a state-of-the-art center that bridges advanced powder making technology, additive manufacturing (AM) and other net-shape parts fabrication, and non-destructive evaluation with professional development.  This unique research and prototyping facility offers custom powder-based parts fabrication and qualification under one roof, catalyzing rapid manufacturing implementation.  Powder-to-Parts can be accessed via the MPC (see above).",R&D Agreements for Facility Access,www.ameslab.gov,mpc@ameslab.gov,(515) 294-2772
DOE,Ames Laboratory,,"Critical Materials Institute, a DOE Energy Innovation Hub","Technical and Administrative Services Facility
#314",50011,Ames,IA,US,"The CMI  focuses on technologies that make better use of materials and eliminate the need for materials that are subject to supply disruptions. These critical materials are essential for American competitiveness in clean energy.  Various facilities are available for use under  CMI Memebership Program. An example being the LENS  (Laser-Engineered Near-Netshape System)  for bulk-combinatorial materials assessment. Critical Materials Institute is helping the United States in four ways: (1) Diversifying supplies.  (2) Developing new substitute materials. (3) Using the available materials more efficiently. And, (4) Forecasting what materials might become critical in the future.   ",R&D Agreements for Facility Access,https://cmi.ameslab.gov,covey@ameslab.gov ,(515) 294-2773
DOE,Argonne National Laboratory,,Advanced Photon Source (APS),9700 S Cass Ave B109,60439,Lemont,IL,US,"The APS at Argonne National Laboratory is one of only three third-generation, hard x-ray synchrotron radiation light sources in the world. The 1,104-meter circumference facility—large enough to house a baseball park in its center—includes 34 bending magnets and 34 insertion devices, which generate a capacity of 68 beamlines for experimental research. Instruments on these beamlines attract researchers to study the structure and properties of materials in a variety of disciplines, including condensed matter physics, materials sciences, chemistry, geosciences, structural biology, medical imaging, and environmental sciences. The high-quality, reliable x-ray beams at the APS have already brought about new discoveries in materials structure.",User Facility,http://www.aps.anl.gov/,partners@anl.gov,(515) 294-2774
DOE,Argonne National Laboratory,,Argonne Leadership Computing Facility (ALCF),9700 S Cass Ave B109,60439,Lemont,IL,US,"In operation since 2006, the Argonne Leadership Computing Facility houses world-class supercomputing resources for open science. It supports a wide range of science and engineering research and serves users from academia, industry, and the national laboratories. The ALCF provides comprehensive services from training to performance engineering to data analysis, and operates a unique catalyst program to assist the individual science teams to achieve optimal performance and results on ALCF systems from day one. Argonne's current supercomputing resource is Mira, a 10-petaflops IBM Blue Gene/Q system, consisting of 48 racks, 786,432 cores, and 768 terabytes of memory.. The center serves elite computational scientists from all areas of the research community through user programs such as the Innovative and Novel Computational Impact on Theory and Experiment (INCITE) program and the Department of Energy’s ASCR Leadership Computing Challenge (ALCC) program, delivering state-of-the-art computing, data, visualization, and analytics resources to solve the world’s most challenging science problems.",User Facility,http://www.alcf.anl.gov/,partners@anl.gov,(515) 294-2775
DOE,Argonne National Laboratory,,Argonne Tandem Linac Accelerator System (ATLAS),9700 S Cass Ave B109,60439,Lemont,IL,US,"ATLAS is a national user facility at Argonne National Laboratory in Argonne, Illinois. The ATLAS facility is a leading facility for nuclear structure research in the United States. It provides a wide range of beams for nuclear reaction and structure research to a large community of users from the US and abroad. The full range of all stable ions can be produced in ECR ion sources, accelerated in the world’s first superconducting linear accelerator for ions to energies of 7-17 MeV per nucleon and delivered to one of several target stations. About 20% of the beam-time is used to generate secondary radioactive beams. These beams are used mostly to study nuclear reactions of astrophysical interest and for nuclear structure investigations. Users of ATLAS take advantage of the existing experimental equipment such as, for example, the Canadian Penning Trap (CPT), the Fragment Mass Analyzer (FMA), the magnetic spectrograph and Gammasphere. Beam lines are also available for experiments where Users bring their own equipment. The Physics support group is available to assist the Users in all preparations for their measurements.",User Facility,http://www.phy.anl.gov/atlas/,partners@anl.gov,(515) 294-2776
DOE,Argonne National Laboratory,,Argonne Wakefield Accelerator,9700 S Cass Ave B109,60439,Lemont,IL,US,"The Argonne Wakefield Accelerator (AWA) in the HEP division at the Argonne National Laboratory is a test facility for one of the leading advanced accelerator technologies for electron beams, dielectric wakefield acceleration.  The AWA has recently gone through an upgrade of the drive beam energy to 75 MeV, with a second, 15 MeV witness beam.  The AWA conducts experiments and produces and publishes results on many topics including advanced acceleration, GW-scale rf sources, phase space manipulation and positron acceleration.  The AWA also has strong partnerships with industry through SBIRs.",User Facility,http://gate.hep.anl.gov/awa/,ryoshida@anl.gov,(630) 252-7874
DOE,Argonne National Laboratory,,Battery Test Facility- Electrochemical Analysis and Diagnostics Laboratory,9700 S Cass Ave B109,60439,Lemont,IL,US,"The Electrochemical Analysis and Diagnostics Laboratory (EADL) provides battery developers with reliable, independent, and unbiased performance evaluations of their cells, modules, and battery packs.  These evaluations have been performed for the U.S. Department of Energy (DOE), government and industry consortia, and industrial developers to provide insight into the factors that limit the performance and life of advanced battery systems. Such evaluations help battery developers and DOE evaluate technical progress, and aid DOE in R&D decision-making.   The EADL is an extensive facility designed to test large numbers of both small and large batteries designed within and outside of Argonne National Laboratory. It has the capability to conduct >240 concurrent advanced battery studies under operating conditions that simulate electric-vehicle (EV), electric-hybrid vehicle (HEV), utility load-leveling, and standby/uninterruptible power source applications. Each battery is independently defined, controlled and monitored to impose charging regimes and discharge load profiles that simulate the types of dynamic operating conditions found during actual use.  The facility is supported by the US Department of Energy, Office of Vehicle Technologies, Hybrid and Electric Systems.",User Facility,http://www.cse.anl.gov/facilities/eadl.html,burrell@anl.gov,(630) 252-2629
DOE,Argonne National Laboratory,,Battery Post-Test Facility,9700 S Cass Ave B109,60439,Lemont,IL,US,"Post-test diagnostics of aged batteries can provide additional information regarding the cause of performance degradation, which, previously, could be only inferred from the changes in electrochemical performance data.  The results from physical, spectroscopic, metallographic, electrochemical tests will be used to characterize the physical and chemical changes which occurred during the aging process.  Conclusions from these results can aid in the further improvement of a given technology by showing where work may need to be done.  The experience and techniques developed in DOE’s applied battery R&D program are used in a standardized fashion, similar to the performance test protocols, making comparisons of failure modes within a given technology and perhaps, across technologies easier.  The Facility is available to help DOE’s battery programs and to help industrial battery developers better understand life-limiting mechanisms specific to their technology. The facility is supported by the US Department of Energy, Office of Vehicle Technologies, Hybrid and Electric Systems.",User Facility,http://www.cse.anl.gov/facilities/ptf.html,burrell@anl.gov,(630) 252-2629
DOE,Argonne National Laboratory,,"Cell Analysis, Modeling, and Prototyping Facility (CAMP)-Battery Cell Fabrication Facility",9700 S Cass Ave B109,60439,Lemont,IL,US,"The goal of Argonne’s Cell Analysis, Modeling, and Prototyping (CAMP) Facility is to design, fabricate, and characterize high-quality prototype cells using the latest discoveries in high energy anode and cathode battery materials created at Argonne and in research labs around the world. Its manufactured cells have at least a 200mAh capacity and enable a realistic and consistent evaluation of candidate chemistries in a timely manner and in a close-to-real industrial format. The CAMP Facility is appropriately scaled to help new materials move more easily from bench top discovery to industrial production. Within a climate-controlled dry room, the CAMP Facility’s high tech equipment includes a planetary mixer with a high speed disperser, a high precision electrode coater with two drying zones, and a hot roll press, which enables the fabrication of high-quality electrodes. These electrodes are used to make pouch (in an xx3450 format) and 18650 cells using the CAMP Facility’s semi-automated industrial cell assembly equipment.",User Facility,http://www.cse.anl.gov/facilities/cellfabrication.html,burrell@anl.gov,(630) 252-2629
DOE,Argonne National Laboratory,,Center for Nanoscale Materials (CNM),9700 S Cass Ave B109,60439,Lemont,IL,US,"The CNM at Argonne National Laboratory focuses on research in advanced magnetic materials, complex oxides, nanophotonics, and bio-inorganic hybrids. The facility uses existing facilities such as the Advanced Photon Source, the Intense Pulsed Neutron Source, and the Electron Microscopy Center. An x-ray nanoprobe beam line at the Advanced Photon Source is run by the Center for its users. The State of Illinois provided funding for construction of the building, which is appended to the Advanced Photon Source. BES provides funding for clean rooms and specialized equipment as well as the facility operations.",User Facility,http://nano.anl.gov/,gkrumdick@anl.gov,(630) 252-3952
DOE,Argonne National Laboratory,,Electron Microscopy Center for Materials Research,9700 S Cass Ave B109,60439,Lemont,IL,US,"The EMCMR at Argonne National Laboratory provides in-situ, high-voltage and intermediate voltage, high-spatial resolution electron microscope capabilities for direct observation of ion-solid interactions during irradiation of samples with high-energy ion beams. The EMC employs both a tandem accelerator and an ion implanter in conjunction with a transmission electron microscope for simultaneous ion irradiation and electron beam microcharacterization. It is the only instrumentation of its type in the western hemisphere. The unique combination of two ion accelerators and an electron microscope permits direct, real-time, in-situ observation of the effects of ion bombardment of materials and consequently attracts users from around the world. Research at EMC includes microscopy based studies on high-temperature superconducting materials, irradiation effects in metals and semiconductors, phase transformations, and processing related structure and chemistry of interfaces in thin films.",User Facility,http://www.msd.anl.gov/groups/emc/,gkrumdick@anl.gov,(630) 252-3952
DOE,Argonne National Laboratory,,High Throughput Facility,9700 S Cass Ave B109,60439,Lemont,IL,US,"Argonne’s high throughput facility provides highly automated and parallel approaches to material and materials chemistry development. The facility allows scientists to synthesize and screen large numbers of compounds and optimize their reaction or process conditions much more rapidly than the conventional approach, thereby reducing the time and cost for material development. The facility consists of a robotic platform with solid and liquid handling and dispensing capabilities focused on accelerating the discovery and optimization of new materials. A screening pressure reactor for catalyst screening, materials treatments, and process optimization at temperatures up to 400°C and pressures up to 3000 psig under a wide range of gas compositions. Analytical equipment configured for high-throughput analyses including a X-ray diffractometer, LC-MS and a GC-MS. Computer software to facilitate experimental design, data mining and data evaluation. Current applications are in catalysis, energy storage, fuel cells, artificial photosynthesis, gas separation and storage, and nanoscale materials.

",R&D Agreements for Facility Access,http://www.cse.anl.gov/pdfs/HTRbrochure.pdf,krauset@anl.gov,(630) 252-4356
DOE,Argonne National Laboratory,,Materials Engineering Research Facility (MERF),9700 S Cass Ave B109,60439,Lemont,IL,US,"Argonne’s Materials Engineering Research Facility (MERF) enables engineers to develop manufacturing processes for producing advanced battery materials in sufficient quantity for industrial testing.   Central to the facility, it includes high-hazard “Group H” occupancy pilot- and high-bay laboratory spaces, enabling the process development and scale up of batch and continuous production of the necessary quantities of materials for subsequent validation and/or evaluation in prototypes cells.  The labs are equipped to quickly scale and validate battery chemistries from bench-top experiments to production of bulk quantities of battery materials for prototype testing. As an ISO 9001 and ISO 14001 certified laboratory, Argonne’s new MERF facility adheres to the internationally recognized standards for business practices and environmental management.  The facility is supported by the US Department of Energy, Office of Vehicle Technologies.",R&D Agreements for Facility Access,www.anl.gov/merf,gkrumdick@anl.gov,(630) 252-3952
DOE,Argonne National Laboratory,,SCRF Processing Facility,9700 S Cass Ave B109,60439,Lemont,IL,US,"The Physics Division operates  a facility for chemical processing, electro-polishing and high-pressure water rinsing of niobium coated surfaces of superconducting radiofrequency structures for accelerators. The facility also includes test cryostats fully equipped for characterization of cavity performance. The facility is operated jointly with FNAL.
",R&D Agreements for Facility Access,,janssens@anl.gov,(630) 252-8426
DOE,Argonne National Laboratory,,Structural Biology Center,9700 S Cass Ave B109,60439,Lemont,IL,US,"[Part of the Advanced Photon Source user facility.]  The SBC is a world-class facility for macromolecular x-ray crystallography.  It operates two beamlines at the Advanced Photon Source lines, one insertion-device and one bending magnet, both of which can be accessed remotely.  Over 4,000 structure deposits can be attributed to the SBC and 1,400 publications.  SBC is continually advancing its technology and is leading the development of high throughput protein crystallography.",R&D Agreements for Facility Access,http://www.sbc.anl.gov,grahamr@anl.gov,(630) 252-5677
DOE,Argonne National Laboratory,,Southern Great Plains Atmospheric Radiation Measurement Site,9700 S Cass Ave B109,60439,Lemont,IL,US,"The Southern Great Plains Atmospheric Radiation Measurement Site (SGP-ARM) is the oldest and largest of DOE's Arm sites.  It was established in 1992.  It consists of in situ and remote-sensing instrument clusters arrayed across approximately 143,000 square kilometers in north-central Oklahoma.  Over a hundred instruments ranging from carbon dioxide flux measurements to advanced cloud radars can be found across the site.  Besides maintaining the site, ANL provides instrument mentors to support users.  ANL also coordinates ARM instruments across all the DOE ARM sites.",R&D Agreements for Facility Access,http://arm.gov/sites/sgp,grahamr@anl.gov,(630) 252-5677
DOE,Argonne National Laboratory,,Target Laboratory,9700 S Cass Ave B109,60439,Lemont,IL,US,"[Part of the ATLAS user facility.]  The Physics Division operates a target development laboratory that produces targets and foils of various thickness and substrates, depending on the requirements for experiments performed at the ATLAS and Dynamitron accelerators. The targets are prepared from both naturally occurring materials and stable isotopes, which are supplied, either in pure, elemental form, or as stable compounds. Targets are made not only for the Physics Division but also for other divisions at the Laboratory and for other laboratories and universities.",R&D Agreements for Facility Access,http://www.phy.anl.gov/atlas/targetlab,janssens@anl.gov,(630) 252-8426
DOE,Argonne National Laboratory,,Transportation Research & Analysis Computing Center,9700 S Cass Ave B109 ,60439,Lemont,IL,US,"The technical objectives of the TRACC project included the establishment of a high performance computing center for use by USDOT research teams, including those from Argonne and their university partners, and the use of advanced computing and visualization facilities for the performance of focused computer research and development programs in areas of interest for USDOT. These objectives were met by establishing a high-performance computing facility, known as the Transportation Research and Analysis Computing Center (TRACC), and providing technical support for its use by USDOT staff and their university and industry contractors. Starting in FY2013, TRACC increased its emphasis on establishing cost-sharing research programs through sponsored research with other Federal and non-Federal sponsors. This allows TRACC to take advantage of not only its state-of-the-art high performance computing resources but also the scientific expertise of its staff for Transportation Research and Analysis in the areas of:
Traffic Modeling and Simulation and Emergency Transportation Planning
Computational Fluid Dynamics for Infrastructure Analysis
Computational Structural Mechanics for Transportation Applications",User Facility,https://www.tracc.anl.gov/index.php/about-tracc,hley@anl.gov,(630) 252-8224
DOE,Argonne National Laboratory,,US ATLAS Analysis Support Center,9700 S Cass Ave B109 ,60439,Lemont,IL,US,"The HEP division at Argonne National Laboratory hosts one of the three Analysis Support Centers for the US ATLAS collaboration that is a part of the international ATLAS collaboration that operates one of the two multipurpose detectors at the Large Hadron Collider.  The center hosts meetings and workshops both specifically for US ATLAS as well as those for the larger ATLAS community.  The center also provides Tier3 computing capability for visitors.  There are, on the average, 10-12 long term visitors to the center, including University Staff and graduate students.",R&D Agreements for Facility Access,http://atlaswww.hep.anl.gov/asc/,ryoshida@anl.gov,(630) 252-7874
DOE,Brookhaven National Laboratory,,Center for Functional Nanomaterials (CFN),2 Center St,11973,Upton ,NY,US,"The CFN at Brookhaven National Laboratory focuses on understanding the chemical and physical response of nanomaterials to make functional materials such as sensors, activators, and energy-conversion devices. The facility uses existing facilities such as the National Synchrotron Light Source and the Laser Electron Accelerator facility. It also provides clean rooms, general laboratories, and wet and dry laboratories for sample preparation, fabrication, and analysis. Equipment includes that needed for laboratory and fabrication facilities for e-beam lithography, transmission electron microscopy, scanning probes and surface characterization, material synthesis and fabrication, and spectroscopy.",User Facility,http://www.bnl.gov/cfn/,guvcenter@bnl.gov ,(631) 344-3333
DOE,Brookhaven National Laboratory,,National Synchrotron Light Source (NSLS),2 Center St,11973,Upton ,NY,US,"The NSLS at Brookhaven National Laboratory, commissioned in 1982, consists of two distinct electron storage rings. The x-ray storage ring is 170 meters in circumference and can accommodate 60 beamlines or experimental stations, and the vacuum-ultraviolet (VUV) storage ring can provide 25 additional beamlines around its circumference of 51 meters. Synchrotron light from the x-ray ring is used to determine the atomic structure of materials using diffraction, absorption, and imaging techniques. Experiments at the VUV ring help solve the atomic and electronic structure as well as the magnetic properties of a wide array of materials. These data are fundamentally important to virtually all of the physical and life sciences as well as providing immensely useful information for practical applications. NSLS will be replaced by a new light source, NSLS-II, which is currently under construction. NSLS-II will be optimized to deliver ultra-high brightness and flux and exceptional beam stability, enabling the study of material properties and functions down to a spatial resolution of 1 nm and energy resolution of 0.1 meV, with sensitivity sufficient to perform spectroscopy on a single atom.",User Facility,http://www.nsls.bnl.gov/,guvcenter@bnl.gov ,(631) 344-3333
DOE,Brookhaven National Laboratory,,"Accelerator Center for Energy Research (ACER)

",2 Center St,11973,Upton ,NY,US,"The Accelerator Center for Energy Research (ACER) exploits radiation chemistry techniques to study chemical reactions (and other phenomena) by subjecting samples to pulses of high-energy electrons or continuous gamma rays. The reactions are followed by various methods of time-resolved spectroscopy and other detection techniques. ACER includes the picosecond Laser-Electron Accelerator Facility (LEAF), a 2 MeV electron Van de Graaff, and a cobalt-60 source.",User Facility,http://www.chemistry.bnl.gov/SciandTech/PRC/crcrintr.html,guvcenter@bnl.gov ,(631) 344-3333
DOE,Brookhaven National Laboratory,,Relativistic Heavy Ion Collider (RHIC),2 Center St,11973,Upton ,NY,US,"RHIC at Brookhaven National Laboratory is a world-class scientific research facility that began operation in 2000, following 10 years of development and construction. Hundreds of physicists from around the world use RHIC to study what the universe may have looked like in the first few moments after its creation. RHIC drives two intersecting beams of gold ions head-on, in a subatomic collision. What physicists learn from these collisions may help us understand more about why the physical world works the way it does, from the smallest subatomic particles, to the largest stars.",User Facility,http://www.bnl.gov/rhic/,guvcenter@bnl.gov ,(631) 344-3333
DOE,Brookhaven National Laboratory,,Tandem Van de Graaff facility,2 Center St,11973,Upton ,NY,US,"Completed in 1970, the Tandem Van de Graaff facility was for many years the world's largest electrostatic accelerator facility. It can provide researchers with beams of more than 40 different types of ions — atoms that have been stripped of their electrons. Ions ranging from hydrogen to uranium are available. The facility consists of two 15-million-volt electrostatic accelerators, each about 24 meters long, aligned end-to-end.",User Facility,http://www.bnl.gov/science/accelerators/TVdG.php,guvcenter@bnl.gov ,(631) 344-3333
